{
  "counts": {
    "kind.SEED": 2,
    "lora_a.VALIDATION": 1,
    "lora_b.TRAIN": 1,
    "origin.FAILURE_CASE_SEED": 2
  },
  "dataset_digest": "sha256:f3a4b3d56b1fd42f1a89bab7f7f4f586c5cfaeb6058a7aa04f518743e51d269a",
  "dataset_id": "ds-dev",
  "dropped": {
    "duplicate_input": 0,
    "synthetic_dropped_for_seed_input": 0
  },
  "generation": {
    "seed_lora_a": 1,
    "seed_lora_b": 1
  },
  "job_version": "0.2.0",
  "notes": [],
  "pii_suspect": {
    "patterns": [
      "email",
      "phone_landline",
      "phone_mobile",
      "rrn"
    ],
    "rows_total": 0
  },
  "result": {
    "content_hash": "sha256:c6bdfc036d7aad04183a407010302631d7e53abba411d4e17d3e9076b5480231",
    "status": "PUBLISHED",
    "version": "vf3a4b3d56b1fd42f1a89bab7f7f4f586"
  },
  "skipped_seeds": []
}
